{
  "fixture_version": "0.1",
  "label": "level_1_first_kill",
  "synthetic": true,
  "target_profile": "tbc_243_lab",
  "adapter": "fixture_tbc_243:0.1.0",
  "session_id": "fixture-session-first-kill",
  "champion_id": "fixture-not-champion",
  "events": [
    {
      "raw_event_id": "event:login:001",
      "kind": "login",
      "game_time_ms": 0,
      "captured_at": "2026-08-22T10:00:00Z",
      "facts": [
        { "raw_key": "player_level", "value": 1, "source": "client_observed", "capability": "self_state", "confidence": 1.0, "observed_at": "2026-08-22T10:00:00Z" },
        { "raw_key": "player_xp", "value": 0, "source": "client_observed", "capability": "level_progress", "confidence": 1.0, "observed_at": "2026-08-22T10:00:00Z" }
      ]
    },
    {
      "raw_event_id": "event:target:002",
      "kind": "target_acquired",
      "game_time_ms": 1200,
      "captured_at": "2026-08-22T10:00:01.200Z",
      "facts": [
        { "raw_key": "target_guid", "value": "fixture-creature-0001", "source": "client_observed", "capability": "target_state", "confidence": 1.0, "observed_at": "2026-08-22T10:00:01.200Z" },
        { "raw_key": "target_name", "value": "Young Wolf", "source": "client_observed", "capability": "target_state", "confidence": 1.0, "observed_at": "2026-08-22T10:00:01.200Z" },
        { "raw_key": "target_kind", "value": "npc", "source": "client_observed", "capability": "target_state", "confidence": 1.0, "observed_at": "2026-08-22T10:00:01.200Z" },
        { "raw_key": "target_health_pct", "value": 100, "source": "client_observed", "capability": "target_state", "confidence": 1.0, "observed_at": "2026-08-22T10:00:01.200Z" }
      ]
    },
    {
      "raw_event_id": "event:combat-start:003",
      "kind": "combat_start",
      "game_time_ms": 2100,
      "captured_at": "2026-08-22T10:00:02.100Z",
      "facts": [
        { "raw_key": "combat_state", "value": "started", "source": "client_observed", "capability": "combat_log", "confidence": 1.0, "observed_at": "2026-08-22T10:00:02.100Z" },
        { "raw_key": "target_guid", "value": "fixture-creature-0001", "source": "client_observed", "capability": "target_state", "confidence": 1.0, "observed_at": "2026-08-22T10:00:02.100Z" }
      ]
    },
    {
      "raw_event_id": "event:cast:004",
      "kind": "cast",
      "game_time_ms": 2700,
      "captured_at": "2026-08-22T10:00:02.700Z",
      "facts": [
        { "raw_key": "spell_used", "value": "sinister_strike", "source": "client_observed", "capability": "combat_log", "confidence": 1.0, "observed_at": "2026-08-22T10:00:02.700Z" }
      ]
    },
    {
      "raw_event_id": "event:damage:005",
      "kind": "damage",
      "game_time_ms": 2750,
      "captured_at": "2026-08-22T10:00:02.750Z",
      "facts": [
        { "raw_key": "damage_amount", "value": 19, "source": "client_observed", "capability": "combat_log", "confidence": 1.0, "observed_at": "2026-08-22T10:00:02.750Z" },
        { "raw_key": "target_health_pct", "value": 42, "source": "client_observed", "capability": "target_state", "confidence": 0.95, "observed_at": "2026-08-22T10:00:02.750Z" }
      ]
    },
    {
      "raw_event_id": "event:kill:006",
      "kind": "kill",
      "game_time_ms": 3900,
      "captured_at": "2026-08-22T10:00:03.900Z",
      "facts": [
        { "raw_key": "target_dead", "value": true, "source": "client_observed", "capability": "combat_log", "confidence": 1.0, "observed_at": "2026-08-22T10:00:03.900Z" },
        { "raw_key": "target_guid", "value": "fixture-creature-0001", "source": "client_observed", "capability": "target_state", "confidence": 1.0, "observed_at": "2026-08-22T10:00:03.900Z" },
        { "raw_key": "target_health_pct", "value": 0, "source": "client_observed", "capability": "target_state", "confidence": 1.0, "observed_at": "2026-08-22T10:00:03.900Z" }
      ]
    },
    {
      "raw_event_id": "event:loot:007",
      "kind": "loot",
      "game_time_ms": 4700,
      "captured_at": "2026-08-22T10:00:04.700Z",
      "facts": [
        { "raw_key": "loot_item", "value": "item.synthetic_torn_fur", "source": "client_observed", "capability": "loot_observation", "confidence": 1.0, "observed_at": "2026-08-22T10:00:04.700Z" }
      ]
    },
    {
      "raw_event_id": "event:level-up:008",
      "kind": "level_up",
      "game_time_ms": 5200,
      "captured_at": "2026-08-22T10:00:05.200Z",
      "facts": [
        { "raw_key": "player_level_reached", "value": 2, "source": "client_observed", "capability": "level_progress", "confidence": 1.0, "observed_at": "2026-08-22T10:00:05.200Z" },
        { "raw_key": "player_level", "value": 2, "source": "client_observed", "capability": "self_state", "confidence": 1.0, "observed_at": "2026-08-22T10:00:05.200Z" }
      ]
    }
  ]
}
